https://roll20.net/compendium/dnd5e/Spells:Prismatic%20Spray#h-Prismatic%20Spray,Prismatic Spray,"Eight multicolored rays of light flash from your hand. Each ray is a different color and has a different power and purpose. Each creature in a 60-foot cone must make a Dexterity saving throw. For each target, roll a d8 to determine which color ray affects it.1-Red: The target takes 10d6 fire damage on a failed save, or half as much damage on a successful one.2-Orange: The target takes 10d6 acid damage on a failed save, or half as much damage on a successful one.3-Yellow: The target takes 10d6 lightning damage on a failed save, or half as much damage on a successful one.4-Green: The target takes 10d6 poison damage on a failed save, or half as much damage on a successful one.5-Blue: The target takes 10d6 cold damage on a failed save, or half as much damage on a successful one.6-Indigo: On a failed save, the target is Restrained. It must then make a Constitution saving throw at the end of each of its turns. If it successfully saves three times, the spell ends. If it fails its save three times, it permanently turns to stone and is subjected to the Petrified condition. The successes and failures don't need to be consecutive, keep track of both until the target collects three of a kind.7-Violet: On a failed save, the target is Blinded. It must then make a Wisdom saving throw at the start of your next turn. A successful save ends the blindness. If it fails that save, the creature is transported to another plane of existence of the DM's choosing and is no longer Blinded. (Typically, a creature that is on a plane that isn't its home plane is banished home, while other creatures are usually cast into the Astral or Ethereal planes.)8-Special: The target is struck by two rays. Roll twice more, rerolling any 8.",1 action,"Sorcerer,  Wizard",V S,10d6,"Fire, acid, lightning, poison, or cold",Instantaneous,NA,NA,7,NA,Self,Evocation,NA,NA,NA,NA,SRD 5.0,NA,NA,Dexterity,NA,NA,Each creature in a 60-foot cone,Half damage,NA,NA,NA,NA,NA
https://roll20.net/compendium/dnd5e/Spells:Prismatic%20Wall#h-Prismatic%20Wall,Prismatic Wall,"A shimmering, multicolored plane of light forms a vertical opaque wall - up to 90 feet long, 30 feet high, and 1 inch thick - entered on a point you can see within range. Alternatively, you can shape the wall into a Sphere up to 30 feet in diameter centered on a point you choose within range.The wall remains in place for the Duration. If you position the wall so that it passes through a space occupied by a creature, the spell fails, and your action and the spell slot are wasted. The wall sheds bright light out to a range of 100 feet and dim light for an additional 100 feet. You and creatures you designate at the time you cast the spell can pass through and remain near the wall without harm. If another creature that can see the wall moves to within 20 feet of it or starts its turn there, the creature must succeed on a Constitution saving throw or become Blinded for 1 minute.The wall consists of seven layers, each with a different color. When a creature attempts to reach into or pass through the wall, it does so one layer at a time through all the wall's layers. As it passes or reaches through each layer, the creature must make a Dexterity saving throw or be affected by that layer's properties as described below.The wall can be destroyed, also one layer at a time, in order from red to violet, by means specific to each layer. Once a layer is destroyed, it remains so for the Duration of the spell. A rod of cancellation destroys a prismatic wall, but an Antimagic Field has no effect on it.Red: The creature takes 10d6 fire damage on a failed save, or half as much damage on a successful one. While this layer is in place, nonmagical Ranged Attacks can't pass through the wall. The layer can be destroyed by dealing at least 25 cold damage to it.Orange: The creature takes 10d6 acid damage on a failed save, or half as much damage on a successful one. While this layer is in place, magical Ranged Attacks can't pass through the wall. The layer is destroyed by a strong wind.Yellow: The creature takes 10d6 lightning damage on a failed save, or half as much damage on a successful one. This layer can be destroyed by dealing at least 60 force damage to it.Green: The creature takes 10d6 poison damage on a failed save, or half as much damage on a successful one. A Passwall spell, or another spell of equal or greater level that can open a portal on a solid surface, destroys this layer.Blue: The creature takes 10d6 cold damage on a failed save, or half as much damage on a successful one. This layer can be destroyed by dealing at least 25 fire damage to it.Indigo: On a failed save, the creature is Restrained. It must then make a Constitution saving throw at the end of each of its turns. If it successfully saves three times, the spell ends. If it fails its save three times, it permanently turns to stone and is subjected to the Petrified condition. The successes and failures don't need to be consecutive, keep track of both until the creature collects three of a kind. While this layer is in place, Spells can't be cast through the wall. The layer is destroyed by bright light shed by a Daylight spell or a similar spell of equal or higher level.Violet: On a failed save, the creature is Blinded. It must then make a Wisdom saving throw at the start of your next turn. A successful save ends the blindness. If it fails that save, the creature is transported to another plane of the DM's choosing and is no longer Blinded. (Typically, a creature that is on a plane that isn't its home plane is banished home, while other creatures are usually cast into the Astral or Ethereal planes.) This layer is destroyed by a Dispel Magic spell or a similar spell of equal or higher level that can end Spells and magical effects.",1 action,Wizard,V S,10d6,"Fire, acid, lightning, poison, or cold",10 minutes,NA,NA,9,NA,60 ft,Abjuration,NA,NA,NA,NA,SRD 5.0,NA,NA,Dexterity,NA,NA,A creature attempts to reach into or pass through the wall,Half damage,NA,NA,NA,NA,NA
https://roll20.net/compendium/dnd5e/Spells:Private%20Sanctum#h-Private%20Sanctum,Private Sanctum,"You make an area within range magically secure. The area is a cube that can be as small as 5 feet to as large as 100 feet on each side. The spell lasts for the Duration or until you use an action to dismiss it.When you cast the spell, you decide what sort of security the spell provides, choosing any or all of the following properties.• Sound can't pass through the barrier at the edge of the warded area.• The barrier of the warded area appears dark and foggy, preventing vision (including darkvision) through it.• Sensors created by Divination Spells can't appear inside the protected area or pass through the barrier at its perimeter.• Creatures in the area can't be targeted by Divination Spells.• Nothing can Teleport into or out of the warded area.• Planar Travel is blocked within the warded area.Casting this spell on the same spot every day for a year makes this effect permanent.At Higher Levels: When you cast this spell using a spell slot of 5th level or higher, you can increase the size of the cube by 100 feet for each slot level beyond 4th. Thus you could protect a cube that can be up to 200 feet on one side by using a spell slot of 5th level.",10 minutes,Wizard,V S M,NA,NA,24 hours,NA,NA,4,"A thin sheet of lead, a piece of opaque glass, a wad of cotton or cloth, and powdered chrysolite",120 ft,Abjuration,NA,NA,NA,NA,SRD 5.0,NA,NA,NA,NA,NA,NA,NA,NA,NA,NA,NA,NA
https://roll20.net/compendium/dnd5e/Spells:Produce%20Flame#h-Produce%20Flame,Produce Flame,"A flickering flame appears in your hand. The flame remains there for the Duration and harms neither you nor your Equipment. The flame sheds bright light in a 10-foot radius and dim light for an additional 10 feet. The spell ends if you dismiss it as an action or if you cast it again.You can also Attack with the flame, although doing so ends the spell. When you cast this spell, or as an action on a later turn, you can hurl the flame at a creature within 30 feet of you. Make a ranged spell Attack. On a hit, the target takes 1d8 fire damage.This spell's damage increases by 1d8 when you reach 5th level (2d8), 11th level (3d8), and 17th level (4d8).",1 action,Druid,V S,((@{level} + 1) / 6 + 0.5)d8,Fire,10 minutes,NA,NA,0,NA,Self (30 ft),Conjuration,NA,NA,NA,NA,SRD 5.0,Ranged,NA,NA,NA,NA,NA,NA,NA,NA,NA,NA,NA
https://roll20.net/compendium/dnd5e/Spells:Programmed%20Illusion#h-Programmed%20Illusion,Programmed Illusion,"You create an Illusion of an object, a creature, or some other visible phenomenon within range that activates when a specific condition occurs. The Illusion is imperceptible until then. It must be no larger than a 30-foot cube, and you decide when you cast the spell how the Illusion behaves and what sounds it makes. This scripted performance can last up to 5 minutes.When the condition you specify occurs, the Illusion springs into existence and performs in the manner you described. Once the Illusion finishes performing, it disappears and remains dormant for 10 minutes. After this time, the Illusion can be activated again.The triggering condition can be as general or as detailed as you like, though it must be based on visual or audible Conditions that occur within 30 feet of the area. For example, you could create an Illusion of yourself to appear and warn off others who attempt to open a trapped door, or you could set the Illusion to trigger only when a creature says the correct word or phrase.Physical interaction with the image reveals it to be an Illusion, because things can pass through it. A creature that uses its action to examine the image can determine that it is an Illusion with a successful Intelligence (Investigation) check against your spell save DC. If a creature discerns the Illusion for what it is, the creature can see through the image, and any noise it makes sounds hollow to the creature.",1 action,"Bard,  Wizard",V S M,NA,NA,Until dispelled,NA,NA,6,A bit of fleece and jade dust worth at least 25 gp,120 ft,Illusion,NA,NA,NA,NA,SRD 5.0,NA,NA,NA,NA,NA,NA,NA,NA,NA,NA,NA,NA
https://roll20.net/compendium/dnd5e/Spells:Project%20Image#h-Project%20Image,Project Image,"You create an illusory copy of yourself that lasts for the Duration. The copy can appear at any location within range that you have seen before, regardless of intervening obstacles. The Illusion looks and sounds like you but is intangible. If the Illusion takes any damage, it disappears, and the spell ends.You can use your action to move this Illusion up to twice your speed, and make it gesture, speak, and behave in whatever way you choose. It mimics your mannerisms perfectly.You can see through its eyes and hear through its ears as if you were in its space. On Your Turn as a Bonus Action, you can switch from using its senses to using your own, or back again. While you are using its senses, you are Blinded and Deafened in regard to your own surroundings.Physical interaction with the image reveals it to be an Illusion, because things can pass through it. A creature that uses its action to examine the image can determine that it is an Illusion with a successful Intelligence (Investigation) check against your spell save DC. If a creature discerns the Illusion for what it is, the creature can see through the image, and any noise it makes sounds hollow to the creature.",1 action,"Bard,  Wizard",V S M,NA,NA,Up to 24 hours,NA,NA,7,A small replica of you made from materials worth at least 5 gp,500 miles,Illusion,NA,NA,NA,NA,SRD 5.0,NA,NA,NA,NA,Yes,NA,NA,NA,NA,NA,NA,NA
https://roll20.net/compendium/dnd5e/Spells:Protection%20from%20Energy#h-Protection%20from%20Energy,Protection from Energy,"For the Duration, the willing creature you touch has Resistance to one damage type of your choice - acid, cold, fire, lightning, or thunder.",1 action,"Cleric,  Druid,  Ranger,  Sorcerer,  Wizard",V S,NA,NA,Up to 1 hour,NA,NA,3,NA,Touch,Abjuration,NA,NA,NA,NA,SRD 5.0,NA,NA,NA,NA,Yes,NA,NA,NA,NA,NA,NA,NA
https://roll20.net/compendium/dnd5e/Spells:Protection%20from%20Evil%20and%20Good#h-Protection%20from%20Evil%20and%20Good,Protection from Evil and Good,"Until the spell ends, one willing creature you touch is protected against certain types of creatures - Aberrations, Celestials, Elementals, fey, Fiends, and Undead.The protection grants several benefits. Creatures of those types have disadvantage on Attack rolls against the target. The target also can't be Charmed, Frightened, or possessed by them. If the target is already Charmed, Frightened, or possessed by such a creature, the target has advantage on any new saving throw against the relevant effect.",1 action,"Cleric,  Paladin,  Warlock,  Wizard",V S M,NA,NA,Up to 10 minutes,NA,NA,1,"Holy Water or powdered silver and iron, which the spell consumes",Touch,Abjuration,NA,NA,NA,NA,SRD 5.0,NA,NA,NA,NA,Yes,NA,NA,NA,NA,NA,NA,NA
https://roll20.net/compendium/dnd5e/Spells:Protection%20from%20Poison#h-Protection%20from%20Poison,Protection from Poison,"You touch a creature. If it is Poisoned, you neutralize the poison. If more than one poison afflicts the target, you neutralize on poison that you know is present, or you neutralize one at random.For the Duration, the target has advantage on saving throws against being Poisoned, and it has Resistance to poison damage.",1 action,"Cleric,  Druid,  Paladin,  Ranger",V S,NA,NA,1 hour,NA,NA,2,NA,Touch,Abjuration,NA,NA,NA,NA,SRD 5.0,NA,NA,NA,NA,NA,NA,NA,NA,NA,NA,NA,NA
https://roll20.net/compendium/dnd5e/Spells:Purify%20Food%20and%20Drink#h-Purify%20Food%20and%20Drink,Purify Food and Drink,All nonmagical food and drink within a 5-foot-radius Sphere centered on a point of your choice within range is purified and rendered free of poison and disease.,1 action,"Cleric,  Druid,  Paladin",V S,NA,NA,Instantaneous,NA,NA,1,NA,10 ft,Transmutation,NA,NA,NA,NA,SRD 5.0,NA,NA,NA,Yes,NA,All nonmagical food and drink within a 5-foot-radius Sphere centered on a point within range,NA,NA,NA,NA,NA,NA
https://roll20.net/compendium/dnd5e/Spells:Raise%20Dead#h-Raise%20Dead,Raise Dead,"You return a dead creature you touch to life, provided that it has been dead no longer than 10 days. If the creature's soul is both willing and at liberty to rejoin the body, the creature returns to life with 1 hit point.This spell also neutralizes any poison and cures nonmagical Diseases that affected the creature at the time it died. This spell doesn't, however, remove magical Diseases, curses, or similar effects, if these aren't first removed prior to casting the spell, they take effect when the creature returns to life. The spell can't return an Undead creature to life.This spell closes all mortal wounds, but it doesn't restore missing body parts. If the creature is lacking body parts or organs integral for its survival - its head, for instance - the spell automatically fails.Coming back from the dead is an ordeal. The target takes a -4 penalty to all Attack rolls, saving throws, and Ability Checks. Every time the target finishes a Long Rest, the penalty is reduced by 1 until it disappears.",1 hour,"Bard,  Cleric,  Paladin",V S M,NA,NA,Instantaneous,NA,NA,5,"A diamond worth at least 500gp, which the spell consumes",Touch,Necromancy,NA,NA,NA,NA,SRD 5.0,NA,NA,NA,NA,NA,NA,NA,NA,NA,NA,NA,NA
https://roll20.net/compendium/dnd5e/Spells:Ray%20of%20Enfeeblement#h-Ray%20of%20Enfeeblement,Ray of Enfeeblement,"A black beam of enervating energy springs from your finger toward a creature within range. Make a ranged spell Attack against the target. On a hit, the target deals only half damage with weapon attacks that use Strength until the spell ends.At the end of each of the target's turns, it can make a Constitution saving throw against the spell. On a success, the spell ends.",1 action,"Warlock,  Wizard",V S,NA,NA,Up to 1 minute,NA,NA,2,NA,60 ft,Necromancy,NA,NA,NA,NA,SRD 5.0,Ranged,NA,Constitution,NA,Yes,NA,Spell ends,NA,NA,NA,NA,NA
https://roll20.net/compendium/dnd5e/Spells:Ray%20of%20Frost#h-Ray%20of%20Frost,Ray of Frost,"A frigid beam of blue-white light streaks toward a creature within range. Make a ranged spell Attack against the target. On a hit, it takes 1d8 cold damage, and its speed is reduced by 10 feet until the start of your next turn.The spell's damage increases by 1d8 when you reach 5th level (2d8), 11th level (3d8), and 17th level (4d8).",1 action,"Sorcerer,  Wizard",V S,1d8,Cold,Instantaneous,NA,NA,0,NA,60 ft,Evocation,NA,NA,NA,NA,SRD 5.0,Ranged,Cantrip Dice,NA,NA,NA,NA,NA,NA,NA,NA,NA,NA
https://roll20.net/compendium/dnd5e/Spells:Regenerate#h-Regenerate,Regenerate,"You touch a creature and stimulate its natural Healing ability. The target regains 4d8 + 15 hit points. For the Duration of the spell, the target regains 1 hit point at the start of each of its turns (10 hit points each minute).The target's severed body members (fingers, legs, tails, and so on), if any, are restored after 2 minutes. If you have the severed part and hold it to the stump, the spell instantaneously causes the limb to knit to the stump.",1 minute,"Bard,  Cleric,  Druid",V S M,NA,NA,1 hour,NA,NA,7,A prayer wheel and Holy Water,Touch,Transmutation,NA,NA,NA,NA,SRD 5.0,NA,NA,NA,NA,NA,NA,NA,NA,NA,4d8 + 15,NA,NA
https://roll20.net/compendium/dnd5e/Spells:Reincarnate#h-Reincarnate,Reincarnate,"You touch a dead humanoid or a piece of a dead humanoid. Provided that the creature has been dead no longer than 10 days, the spell forms a new adult body for it and then calls the soul to enter that body. If the target's soul isn't free or willing to do so, the spell fails.The magic fashions a new body for the creature to inhabit, which likely causes the creature's race to change. The DM rolls a d100 and consults the following table to determine what form the creature takes when restored to life, or the DM chooses a form.d100 - Race:01-04 Dragonborn05-13 Dwarf, hill14-21 Dwarf, mountain22-25 Elf, dark26-34 Elf, high35-42 Elf, wood43-46 Gnome, forest47-52 Gnome, rock53-56 Half-Elf57-60 Half-Orc61-68 Halfling, Lightfoot69-76 Halfling, stout77-96 Human97-00 TieflingThe reincarnated creature recalls its former life and experiences. It retains the capabilities it had in its original form, except it exchanges its original race for the new one and changes its racial traits accordingly.",1 hour,Druid,V S M,NA,NA,Instantaneous,NA,NA,5,"Rare oils and unguents worth at least 1,000 gp, which the spell consumes",Touch,Transmutation,NA,NA,NA,NA,SRD 5.0,NA,NA,NA,NA,NA,NA,NA,NA,NA,NA,NA,NA
https://roll20.net/compendium/dnd5e/Spells:Remove%20Curse#h-Remove%20Curse,Remove Curse,"At your touch, all curses affecting one creature or object end. If the object is a cursed magic item, its curse remains, but the spell breaks its owner's Attunement to the object so it can be removed or discarded.",1 action,"Cleric,  Paladin,  Warlock,  Wizard",V S,NA,NA,Instantaneous,NA,NA,3,NA,Touch,Abjuration,NA,NA,NA,NA,SRD 5.0,NA,NA,NA,NA,NA,NA,NA,NA,NA,NA,NA,NA
https://roll20.net/compendium/dnd5e/Spells:Resilient%20Sphere#h-Resilient%20Sphere,Resilient Sphere,"A Sphere of shimmering force encloses a creature or object of Large size or smaller within range. An unwilling creature must make a Dexterity saving throw. On a failed save, the creature is enclosed for the Duration.Nothing, not physical Objects, energy, or other spell effects, can pass through the barrier, in or out, though a creature in the Sphere can breathe there. The Sphere is immune to all damage, and a creature or object inside can't be damaged by attacks or effects originating from outside, nor can a creature inside the Sphere damage anything outside it.The Sphere is weightless and just large enough to contain the creature or object inside. An enclosed creature can use its action to push against the sphere's walls and thus roll the Sphere at up to half the creature's speed. Similarly, the globe can be picked up and moved by other creatures.A Disintegrate spell targeting the globe destroys it without harming anything inside it.",1 action,Wizard,V S M,NA,NA,Up to 1 minute,NA,NA,4,A hemispherical piece of clear Crystal and a matching hemispherical piece of gum arabic,30 ft,Evocation,NA,NA,NA,NA,SRD 5.0,NA,NA,Dexterity,NA,Yes,NA,NA,NA,NA,NA,NA,NA
https://roll20.net/compendium/dnd5e/Spells:Resistance#h-Resistance,Resistance,"You touch one willing creature. Once before the spell ends, the target can roll a d4 and add the number rolled to one saving throw of its choice. It can roll the die before or after the saving throw. The spell then ends.",1 action,"Cleric,  Druid",V S M,NA,NA,Up to 1 minute,NA,NA,0,A miniature cloak,Touch,Abjuration,NA,NA,NA,NA,SRD 5.0,NA,NA,NA,NA,Yes,NA,NA,NA,NA,NA,NA,NA
https://roll20.net/compendium/dnd5e/Spells:Resurrection#h-Resurrection,Resurrection,"You touch a dead creature that has been dead for no more than a century, that didn't die of old age, and that isn't Undead. If its soul is free and willing, the target returns to life with all its hit points.This spell neutralizes any Poisons and cures normal Diseases afflicting the creature when it died. It doesn't, however, remove magical Diseases, curses, and the like, if such affects aren't removed prior to casting the spell, they afflict the target on its return to life.This spell closes all mortal wounds and restores any missing body parts.Coming back from the dead is an ordeal. The target takes a -4 penalty to all Attack rolls, saving throws, and Ability Checks. Every time the target finishes a Long Rest, the penalty is reduced by 1 until it disappears.Casting this spell to restore life to a creature that has been dead for one year or longer taxes you greatly. Until you finish a Long Rest, you can't cast Spells again, and you have disadvantage on all Attack rolls, Ability Checks, and saving throws.",1 hour,"Bard,  Cleric",V S M,NA,NA,Instantaneous,NA,NA,7,"A diamond worth at least 1,000gp, which the spell consumes",Touch,Necromancy,NA,NA,NA,NA,SRD 5.0,NA,NA,NA,NA,NA,NA,NA,NA,NA,NA,NA,NA
https://roll20.net/compendium/dnd5e/Spells:Reverse%20Gravity#h-Reverse%20Gravity,Reverse Gravity,"This spell reverses gravity in a 50-foot-radius, 100-foot high Cylinder centered on a point within range. All creatures and Objects that aren't somehow anchored to the ground in the area fall upward and reach the top of the area when you cast this spell. A creature can make a Dexterity saving throw to grab onto a fixed object it can reach, thus avoiding the fall.If some solid object (such as a ceiling) is encountered in this fall, Falling Objects and creatures strike it just as they would during a normal downward fall. If an object or creature reaches the top of the area without striking anything, it remains there, oscillating slightly, for the Duration.At the end of the Duration, affected Objects and creatures fall back down.",1 action,"Druid,  Sorcerer,  Wizard",V S M,NA,NA,Up to 1 minute,NA,NA,7,A lodestone and iron filings,100 ft,Transmutation,NA,NA,NA,NA,SRD 5.0,NA,NA,Dexterity,NA,Yes,"All creatures and Objects that aren't somehow anchored to the ground in a 50-foot-radius, 100-foot-high Cylinder centered on a point within range","Grab onto a fixed object it can reach, thus avoiding the fall",NA,NA,NA,NA,NA
https://roll20.net/compendium/dnd5e/Spells:Revivify#h-Revivify,Revivify,"You touch a creature that has died within the last minute. That creature returns to life with 1 hit point. This spell can't return to life a creature that has died of old age, nor can it restore any missing body parts.",1 action,"Cleric,  Paladin",V S M,NA,NA,Instantaneous,NA,NA,3,"Diamonds worth 300gp, which the spell consumes",Touch,Necromancy,NA,NA,NA,NA,SRD 5.0,NA,NA,NA,NA,NA,NA,NA,NA,NA,NA,NA,NA
https://roll20.net/compendium/dnd5e/Spells:Rope%20Trick#h-Rope%20Trick,Rope Trick,"You touch a length of rope that is up to 60 feet long. One end of the rope then rises into the air until the whole rope hangs perpendicular to the ground. At the upper end of the rope, an Invisible entrance opens to an extradimensional space that lasts until the spell ends.The extradimensional space can be reached by climbing to the top of the rope. The space can hold as many as eight Medium or smaller creatures. The rope can be pulled into the space, making the rope disappear from view outside the space.Attacks and Spells can't cross through the entrance into or out of the extradimensional space, but those inside can see out of it as if through a 3-foot-by-5-foot window centered on the rope.Anything inside the extradimensional space drops out when the spell ends.",1 action,Wizard,V S M,NA,NA,1 hour,NA,NA,2,Powdered corn extract and a twisted loop of Parchment,Touch,Transmutation,NA,NA,NA,NA,SRD 5.0,NA,NA,NA,NA,NA,NA,NA,NA,NA,NA,NA,NA
https://roll20.net/compendium/dnd5e/Spells:Sacred%20Flame#h-Sacred%20Flame,Sacred Flame,"Flame-like radiance descends on a creature that you can see within range. The target must succeed on a Dexterity saving throw or take 1d8 radiant damage. The target gains no benefit from cover for this saving throw.The spell's damage increases by 1d8 when you reach 5th level (2d8), 11th level (3d8), and 17th level (4d8).",1 action,Cleric,V S,1d8,Radiant,Instantaneous,NA,NA,0,NA,60 ft,Evocation,NA,NA,NA,NA,SRD 5.0,NA,Cantrip Dice,Dexterity,NA,NA,NA,NA,NA,NA,NA,NA,NA
