https://roll20.net/compendium/dnd5e/Spells:Heal#h-Heal,Heal,"Choose a creature that you can see within range. A surge of positive energy washes through the creature, causing it to regain 70 hit points. The spell also ends blindness, deafness, and any Diseases affecting the target. This spell has no effect on constructs or Undead.At Higher Levels: When you cast this spell using a spell slot of 7th level or higher, the amount of Healing increases by 10 for each slot level above 6th.",1 action,"Cleric,  Druid",V S,NA,NA,Instantaneous,NA,NA,6,NA,60 ft,Evocation,NA,NA,NA,NA,SRD 5.0,NA,NA,NA,NA,NA,NA,NA,NA,NA,70,10,NA
https://roll20.net/compendium/dnd5e/Spells:Healing%20Word#h-Healing%20Word,Healing Word,"A creature of your choice that you can see within range regains hit points equal to 1d4 + your spellcasting ability modifier. This spell has no effect on Undead or constructs.At Higher Levels: When you cast this spell using a spell slot of 2nd level or higher, the Healing increases by 1d4 for each slot level above 1st.",1 Bonus Action,"Bard,  Cleric,  Druid",V,NA,NA,Instantaneous,1,d4,1,NA,60 ft,Evocation,NA,NA,NA,NA,SRD 5.0,NA,NA,NA,NA,NA,NA,NA,NA,Yes,1d4,NA,NA
https://roll20.net/compendium/dnd5e/Spells:Heat%20Metal#h-Heat%20Metal,Heat Metal,"Choose a manufactured metal object, such as a metal weapon or a suit of heavy or medium metal armor, that you can see within range. You cause the object to glow red-hot. Any creature in physical contact with the object takes 2d8 fire damage when you cast the spell. Until the spell ends, you can use a Bonus Action on each of your subsequent turns to cause this damage again.If a creature is holding or wearing the object and takes the damage from it, the creature must succeed on a Constitution saving throw or drop the object if it can. If it doesn't drop the object, it has disadvantage on Attack rolls and Ability Checks until the start of your next turn.At Higher Levels: When you cast this spell using a spell slot of 3rd level or higher, the damage increases by 1d8 for each slot above 2nd.",1 action,"Bard,  Druid",V S M,2d8,Fire,Up to 1 minute,NA,NA,2,A piece of iron and a flame,60 ft,Transmutation,NA,NA,NA,NA,SRD 5.0,NA,NA,Constitution,NA,Yes,NA,NA,NA,NA,NA,NA,NA
https://roll20.net/compendium/dnd5e/Spells:Hellish%20Rebuke#h-Hellish%20Rebuke,Hellish Rebuke,"You point your finger, and the creature that  damaged you is momentarily surrounded by hellish  flames. The creature must make a Dexterity saving  throw. It takes 2d10 fire damage on a failed save, or  half as much damage on a successful one. At Higher Levels. When you cast this spell using a  spell slot of 2nd level or higher, the damage  increases by 1d10 for each slot level above 1st.","1 reaction, which you take in  response to being damaged by a creature within 60  feet of you that you can see",Warlock,V S,2d10,Fire,Instantaneous,1,d10,1,NA,60 feet,Evocation,NA,NA,NA,NA,SRD 5.1,NA,NA,Dexterity,NA,NA,NA,half damage,NA,NA,NA,NA,NA
https://roll20.net/compendium/dnd5e/Spells:Heroes%27%20Feast#h-Heroes%27%20Feast,Heroes' Feast,"You bring forth a great feast, including magnificent food and drink. The feast takes 1 hour to consume and disappears at the end of that time, and the beneficial effects don't set in until this hour is over. Up to twelve other creatures can partake of the feast.A creature that partakes of the feast gains several benefits. The creature is cured of all Diseases and poison, becomes immune to poison and being Frightened, and makes all Wisdom saving throws with advantage. Its hit point maximum also increases by 2d10, and it gains the same number of hit points. These benefits last for 24 hours.",10 minutes,"Cleric,  Druid",V S M,NA,NA,Instantaneous,NA,NA,6,"A gem-encrusted bowl worth at least 1,000 gp, which the spell consumes",30 ft,Conjuration,NA,NA,NA,NA,SRD 5.0,NA,NA,NA,NA,NA,NA,NA,NA,NA,NA,NA,NA
https://roll20.net/compendium/dnd5e/Spells:Heroism#h-Heroism,Heroism,"A willing creature you touch is imbued with bravery. Until the spell ends, the creature is immune to being Frightened and gains Temporary Hit Points equal to your spellcasting ability modifier at the start of each of its turns. When the spell ends, the target loses any remaining Temporary Hit Points from this spell.At Higher Levels: When you cast this spell using a spell slot of 2nd level or higher, you can target one additional creature for each slot level above 1st.",1 action,"Bard,  Paladin",V S,NA,NA,Up to 1 minute,NA,NA,1,NA,Touch,Enchantment,NA,NA,NA,NA,SRD 5.0,NA,NA,NA,NA,Yes,NA,NA,NA,NA,NA,NA,NA
https://roll20.net/compendium/dnd5e/Spells:Hideous%20Laughter#h-Hideous%20Laughter,Hideous Laughter,"A creature of your choice that you can see within range perceives everything as hilariously funny and falls into fits of laugher if this spell affects it. The target must succeed on a Wisdom saving throw of fall prone, becoming Incapacitated and unable to stand up for the Duration. A creature with an Intelligence score of 4 or less isn't affected.At the end of each of its turns, and each time it takes damage, the target can make another Wisdom saving throw. The target has advantage on the saving throw if it's triggered by damage. On a success, the spell ends.",1 action,"Bard,  Wizard",V S M,NA,NA,Up to 1 minute,NA,NA,1,Tiny tarts and a feather that is waved in the air,30 ft,Enchantment,NA,NA,NA,NA,SRD 5.0,NA,NA,Wisdom,NA,Yes,NA,NA,NA,NA,NA,NA,NA
https://roll20.net/compendium/dnd5e/Spells:Hold%20Monster#h-Hold%20Monster,Hold Monster,"Choose a creature that you can see within range. The target must succeed on a Wisdom saving throw or be Paralyzed for the Duration. This spell has no effect on Undead. At the end of each of its turns, the target can make another Wisdom saving throw. On a success, the spell ends on the target.At Higher Levels: When you cast this spell using a spell slot of 6th level or higher, you can target on additional creature for each slot level above 5th. The creatures must be within 30 feet of each other when you target them.",1 action,"Bard,  Sorcerer,  Warlock,  Wizard",V S M,NA,NA,Up to 1 minute,NA,NA,5,A small piece of iron,90 ft,Enchantment,NA,NA,NA,NA,SRD 5.0,NA,NA,Wisdom,NA,Yes,NA,NA,NA,NA,NA,NA,NA
https://roll20.net/compendium/dnd5e/Spells:Hold%20Person#h-Hold%20Person,Hold Person,"Choose a humanoid that you can see within range. The target must succeed on a Wisdom saving throw or be Paralyzed for the Duration. At the end of each of its turns, the target can make another Wisdom saving throw. On a success, the spell ends on the target.At Higher Levels: When you cast this spell using a spell slot of 3rd level or higher, you can target on additional humanoid for each slot level above 2nd. The humanoids must be within 30 feet of each other when you target them.",1 action,"Bard,  Cleric,  Druid,  Sorcerer,  Warlock,  Wizard",V S M,NA,NA,Up to 1 minute,NA,NA,2,"A small, straight piece of iron",60 ft,Enchantment,NA,NA,NA,NA,SRD 5.0,NA,NA,Wisdom,NA,Yes,NA,NA,NA,NA,NA,NA,NA
https://roll20.net/compendium/dnd5e/Spells:Holy%20Aura#h-Holy%20Aura,Holy Aura,"Divine light washes out from you and coalesces in a soft radiance in a 30-foot radius around you. Creatures of your choice in that radius when you cast this spell shed dim light in a 5-foot radius and have advantage on all saving throws, and other creatures have disadvantage on Attack rolls against them until the spell ends. In addition, when a fiend or an Undead hits an affected creature with a melee Attack, the aura flashes with brilliant light. The attacker must succeed on a Constitution saving throw or be Blinded until the spell ends.",1 action,Cleric,V S M,NA,NA,Up to 1 minute,NA,NA,8,"A tiny Reliquary worth at least 1,000 gp containing a sacred relic, such as a scrap of cloth from a saint's robe or a piece of Parchment from a religious text",Self,Abjuration,NA,NA,NA,NA,SRD 5.0,NA,NA,Constitution,NA,Yes,Creatures of your choice in a 30-foot radius centered on you when you cast this spell,NA,NA,NA,NA,NA,NA
https://roll20.net/compendium/dnd5e/Spells:Hunter%27s%20Mark#h-Hunter%27s%20Mark,Hunter's Mark,"You choose a creature you can see within range and  mystically mark it as your quarry. Until the spell  ends, you deal an extra 1d6 damage to the target  whenever you hit it with a weapon Attack, and you  have advantage on any Wisdom (Perception) or  Wisdom (Survival) check you make to find it. If the  target drops to 0 hit points before this spell ends,  you can use a Bonus Action on a subsequent turn of  yours to mark a new creature.At Higher Levels. When you cast this spell using a  spell slot of 3rd or 4th level, you can maintain your  Concentration on the spell for up to 8 hours. When  you use a spell slot of 5th level or higher, you can maintain your Concentration on the spell for up to 24 hours.",1 Bonus Action,Ranger,NA,NA,NA,"Concentration, up to 1 hour",NA,NA,1,NA,90 feet,Divination,NA,NA,NA,NA,SRD 5.1,NA,NA,NA,NA,YES,NA,NA,NA,NA,NA,NA,NA
https://roll20.net/compendium/dnd5e/Spells:Hypnotic%20Pattern#h-Hypnotic%20Pattern,Hypnotic Pattern,"You create a twisting pattern of colors that weaves through the air inside a 30-foot cube within range. The pattern appears for a moment and vanishes. Each creature in the area who sees the pattern must make a Wisdom saving throw. On a failed save, the creature becomes Charmed for the Duration. While Charmed by this spell, the creature is Incapacitated and has a speed of 0.The spell ends for an affected creature if it takes any damage or if someone else uses an action to shake the creature out of its stupor.",1 action,"Bard,  Sorcerer,  Warlock,  Wizard",S M,NA,NA,Up to 1 minute,NA,NA,3,A glowing stick of incense or a Crystal vial filled with phosphorescent material,120 ft,Illusion,NA,NA,NA,NA,SRD 5.0,NA,NA,Wisdom,NA,Yes,Each creature in the area who sees the pattern,NA,NA,NA,NA,NA,NA
https://roll20.net/compendium/dnd5e/Spells:Ice%20Storm#h-Ice%20Storm,Ice Storm,"A hail of rock-hard ice pounds to the ground in a 20-foot-radius, 40-foot-high Cylinder centered on a point within range. Each creature in the Cylinder must make a Dexterity saving throw. A creature takes 2d8 bludgeoning damage and 4d6 cold damage on a failed save, or half as much damage on a successful one.Hailstones turn the storm's area of effect into difficult terrain until the end of your next turn.At Higher Levels: When you cast this spell using a spell slot of 5th level or higher, the bludgeoning damage increases by 1d8 for each slot level above 4th.",1 action,"Druid,  Sorcerer,  Wizard",V S M,2d8,Bludgeoning,Instantaneous,1,d8,4,A pinch of dust and a few drops of water,300 ft,Evocation,4d6,Cold,NA,NA,SRD 5.0,NA,NA,Dexterity,NA,NA,"Each creature in a 20-foot-radius, 40-foot-high Cylinder centered on a point within range",Half damage,NA,NA,NA,NA,NA
https://roll20.net/compendium/dnd5e/Spells:Identify#h-Identify,Identify,"You choose one object that you must touch throughout the casting of the spell. If it is a magic item or some other magic-imbued object, you learn its properties and how to use them, whether it requires Attunement to use, and how many Charges it has, if any. You learn whether any Spells are affecting the item and what they are. If the item was created by a spell, you learn which spell created it.If you instead touch a creature throughout the casting, you learn what Spells, if any, are currently affecting it.",1 minute,"Bard,  Wizard",V S M,NA,NA,Instantaneous,NA,NA,1,A pearl worth at least 100 gp and an owl feather,Touch,Divination,NA,NA,NA,NA,SRD 5.0,NA,NA,NA,Yes,NA,NA,NA,NA,NA,NA,NA,NA
https://roll20.net/compendium/dnd5e/Spells:Illusory%20Script#h-Illusory%20Script,Illusory Script,"You write on Parchment, paper, or some other suitable writing material and imbue it with a potent Illusion that lasts for the Duration.To you and any creatures you designate when you cast the spell, the writing appears normal, written in your hand, and conveys whatever meaning you intended when you wrote the text. To all others, the writing appears as if it were written in an unknown or magical script that is unintelligible. Alternatively, you can cause the writing to appear to be an entirely different Message, written in a different hand and Language, though the Language must be one you know.Should the spell be dispelled, the original script and the Illusion both disappear.A creature with truesight can read the hidden Message.",1 minute,"Bard,  Warlock,  Wizard",S M,NA,NA,10 days,NA,NA,1,"A lead-based ink worth at least 10gp, which this spell consumes",Touch,Illusion,NA,NA,NA,NA,SRD 5.0,NA,NA,NA,Yes,NA,NA,NA,NA,NA,NA,NA,NA
https://roll20.net/compendium/dnd5e/Spells:Imprisonment#h-Imprisonment,Imprisonment,"You create a magical restraint to hold a creature that you can see within range. The target must succeed on a Wisdom saving throw or be bound by the spell, if it succeeds, it is immune to this spell if you cast it again. While affected by this spell, the creature doesn't need to breathe, eat, or drink, and it doesn't age. Divination Spells can't locate or perceive the target.When you cast the spell, you choose one of the following forms of imprisonment.Burial: The target is entombed far beneath the earth in a Sphere of magical force that is just large enough to contain the target. Nothing can pass through the Sphere, nor can any creature Teleport or use Planar Travel to get into or out of it.The Special component for this version of the spell is a small mithral orb.Chaining: Heavy chains, firmly rooted in the ground, hold the target in place. The target is Restrained until the spell ends, and it can't move or be moved by any means until then.The Special component for this version of the spell is a fine chain of precious metal.Hedged Prison: The spell transports the target into a tiny Demiplane that is warded against teleportation and Planar Travel. The Demiplane can be a labyrinth, a cage, a tower, or any similar confined structure or area of your choice.The Special component for this version of the spell is a miniature representation of the prison made from jade.Minimus Containment: The target shrinks to a height of 1 inch and is imprisoned inside a gemstone or similar object. Light can pass through the gemstone normally (allowing the target to see out and other creatures to see in), but nothing else can pass through, even by means of teleportation or Planar Travel. The gemstone can't be cut or broken while the spell remains in effect.The Special component for this version of the spell is a large, transparent gemstone, such as a corundum, diamond, or ruby.Slumber: The target falls asleep and can't be awoken.The Special component for this version of the spell consists of rare soporific herbs.Ending the Spell: During the casting of the spell, in any of its versions, you can specify a condition that will cause the spell to end and release the target. The condition can be as specific or as elaborate as you choose, but the DM must agree that the condition is reasonable and has a likelihood of coming to pass. The Conditions can be based on a creature's name, identity, or deity but otherwise must be based on observable actions or qualities and not based on intangibles such as level, class, or hit points.A Dispel Magic spell can end the spell only if it is cast as a 9th-level spell, targeting either the prison or the Special component used to create it.You can use a particular Special component to create only one prison at a time. If you cast the spell again using the same component, the target of the first casting is immediately freed from its binding.",1 minute,"Warlock,  Wizard",V S M,NA,NA,Until dispelled,NA,NA,9,"A vellum depiction or a carved statuette in the likeness of the target, and a Special component that varies according to the version of the spell you choose, worth at least 500gp per Hit Die of the target",30 ft,Abjuration,NA,NA,NA,NA,SRD 5.0,NA,NA,Wisdom,NA,NA,NA,It is immune to this spell if you cast it again,NA,NA,NA,NA,NA
https://roll20.net/compendium/dnd5e/Spells:Incendiary%20Cloud#h-Incendiary%20Cloud,Incendiary Cloud,"A swirling cloud of smoke shot through with white-hot embers appears in a 20-foot-radius Sphere centered on a point within range. The cloud spreads around corners and is heavily obscured. It lasts for the Duration or until a wind of moderate or greater speed (at least 10 miles per hour) disperses it.When the cloud appears, each creature in it must make a Dexterity saving throw. A creature takes 10d8 fire damage on a failed save, or half as much damage on a successful one. A creature must also make this saving throw when it enters the spell's area for the first time on a turn or ends its turn there.The cloud moves 10 feet directly away from you in a direction that you choose at the start of each of your turns.",1 action,"Sorcerer,  Wizard",V S,10d8,Fire,Up to 1 minute,NA,NA,8,NA,150 ft,Conjuration,NA,NA,NA,NA,SRD 5.0,NA,NA,Dexterity,NA,Yes,Each creature in a 20-foot-radius Sphere centered on a point within range when it appears or when it enters the spell's area for the first time on a turn or ends its turn there.,Half damage,NA,NA,NA,NA,NA
https://roll20.net/compendium/dnd5e/Spells:Inflict%20Wounds#h-Inflict%20Wounds,Inflict Wounds,"Make a melee spell Attack against a creature you can reach. On a hit, the target takes 3d10 necrotic damage.At Higher Levels: When you cast this spell using a spell slot of 2nd level or higher, the damage increases by 1d10 for each slot level above 1st.",1 action,Cleric,V S,3d10,Necrotic,Instantaneous,1,d10,1,NA,Touch,Necromancy,NA,NA,NA,NA,SRD 5.0,Melee,NA,NA,NA,NA,NA,NA,NA,NA,NA,NA,NA
https://roll20.net/compendium/dnd5e/Spells:Insect%20Plague#h-Insect%20Plague,Insect Plague,"Swarming, biting locusts fill a 20-foot-radius Sphere centered on a point you choose within range. The Sphere spreads around corners. The Sphere remains for the Duration, and its area is lightly obscured. The sphere's area is difficult terrain.When the area appears, each creature in it must make a Constitution saving throw. A creature takes 4d10 piercing damage on a failed save, or half as much damage on a successful one. A creature must also make this saving throw when it enters the spell's area for the first time on a turn or ends its turn there.At Higher Levels: When you cast this spell using a spell slot of 6th level or higher, the damage increases by 1d10 for each slot level above 5th.",1 action,"Cleric,  Druid,  Sorcerer",V S M,4d10,Piercing,Up to 10 minutes,1,d10,5,"A few grains of sugar, some kernels of grain, and a smear of fat",300 ft,Conjuration,NA,NA,NA,NA,SRD 5.0,NA,NA,Constitution,NA,Yes,Each creature in a 20-foot-radius Sphere centered on a point within range when it appears or when it enters the spell's area for the first time on a turn or ends its turn there.,Half damage,NA,NA,NA,NA,NA
https://roll20.net/compendium/dnd5e/Spells:Instant%20Summons#h-Instant%20Summons,Instant Summons,"You touch an object weighing 10 pounds or less whose longest dimension is 6 feet or less. The spell leaves an Invisible mark on its surface and invisibly inscribes the name of the item on the sapphire you use as the material component. Each time you cast this spell, you must use a different sapphire.At any time thereafter, you can use your action to speak the item's name and crush the sapphire. The item instantly appears in your hand regardless of physical or planar distances, and the spell ends.If another creature is holding or carrying the item, crushing the sapphire doesn't transport the item to you, but instead you learn who the creature possessing the object is and roughly where that creature is located at that moment.Dispel Magic or a similar effect successfully applied to the sapphire ends this spell's effect.",1 minute,Wizard,V S M,NA,NA,Until dispelled,NA,NA,6,"A sapphire worth 1,000 gp",Touch,Conjuration,NA,NA,NA,NA,SRD 5.0,NA,NA,NA,Yes,NA,NA,NA,NA,NA,NA,NA,NA
https://roll20.net/compendium/dnd5e/Spells:Invisibility#h-Invisibility,Invisibility,"A creature you touch becomes Invisible until the spell ends. Anything the target is wearing or carrying is Invisible as long as it is on the target's person. The spell ends for a target that attacks or casts a spell.At Higher Levels: When you cast this spell using a spell slot of 3rd level or higher, you can target one additional creature for each slot level above 2nd.",1 action,"Bard,  Sorcerer,  Warlock,  Wizard",V S M,NA,NA,Up to 1 hour,NA,NA,2,An eyelash encased in gum arabic,Touch,Illusion,NA,NA,NA,NA,SRD 5.0,NA,NA,NA,NA,Yes,NA,NA,NA,NA,NA,NA,NA
https://roll20.net/compendium/dnd5e/Spells:Irresistible%20Dance#h-Irresistible%20Dance,Irresistible Dance,"Choose one creature that you can see within range. The target begins a comic dance in place - shuffling, tapping its feet, and capering for the Duration. Creatures that can't be Charmed are immune to this spell.A dancing creature must use all its Movement to dance without leaving its space and has disadvantage on Dexterity saving throws and Attack rolls. While the target is affected by this spell, other creatures have advantage on Attack rolls against it. As an action, a dancing creature makes a Wisdom saving throw to regain control of itself. On a successful save, the spell ends.",1 action,"Bard,  Wizard",V,NA,NA,Up to 1 minute,NA,NA,6,NA,30 ft,Enchantment,NA,NA,NA,NA,SRD 5.0,NA,NA,NA,NA,Yes,NA,NA,NA,NA,NA,NA,NA
https://roll20.net/compendium/dnd5e/Spells:Jump#h-Jump,Jump,You touch a creature. The creature's jump distance is tripled until the spell ends.,1 action,"Druid,  Ranger,  Sorcerer,  Wizard",V S M,NA,NA,1 minute,NA,NA,1,A grasshopper's hind leg,Touch,Transmutation,NA,NA,NA,NA,SRD 5.0,NA,NA,NA,NA,NA,NA,NA,NA,NA,NA,NA,NA
https://roll20.net/compendium/dnd5e/Spells:Knock#h-Knock,Knock,"Choose an object that you can see within range. The object can be a door, a box, a chest, a set of Manacles, a padlock, or another object that contains a mundane or magical means that prevents access.A target that is held shut by a mundane lock or that is stuck or barred becomes unlocked, unstuck, or unbarred. If the object has multiple locks, only one of them is unlocked.If you choose a target that is held shut with Arcane Lock, that spell is suppressed for 10 minutes, during which time the target can be opened and shut normally.When you cast the spell, a loud knock, audible from as far away as 300 feet, emanates from the target object.",1 action,"Bard,  Sorcerer,  Wizard",V,NA,NA,Instantaneous,NA,NA,2,NA,60 ft,Transmutation,NA,NA,NA,NA,SRD 5.0,NA,NA,NA,NA,NA,NA,NA,NA,NA,NA,NA,NA
https://roll20.net/compendium/dnd5e/Spells:Legend%20Lore#h-Legend%20Lore,Legend Lore,"Name or describe a person, place, or object. The spell brings to your mind a brief summary of the significant lore about the thing you named. The lore might consist of current tales, forgotten stories, or even secret lore that has never been widely known. If the thing you named isn't of legendary importance, you gain no information.The more information you already have about the thing, the more precise and detailed the information you receive is. The information you learn is accurate but might be couched in figurative Language. For example, if you have a mysterious magic axe on hand, the spell might yield this information - Woe to the evildoer whose hand touches the axe, for even the haft slices the hand of the evil ones. Only a true Child of Stone, lover and beloved of Moradin, may Awaken the true powers of the axe, and only with the sacred word Rudnogg on the lips.",10 minutes,"Bard,  Cleric,  Wizard",V S M,NA,NA,Instantaneous,NA,NA,5,"Incense worth at least 250 gp, which the spell consumes, and four ivory strips worth 50 gp each",Self,Divination,NA,NA,NA,NA,SRD 5.0,NA,NA,NA,NA,NA,NA,NA,NA,NA,NA,NA,NA
https://roll20.net/compendium/dnd5e/Spells:Lesser%20Restoration#h-Lesser%20Restoration,Lesser Restoration,"You touch a creature and can end either one disease or one condition afflicting it. The condition can be Blinded, Deafened, Paralyzed, or Poisoned.",1 action,"Bard,  Cleric,  Druid,  Paladin,  Ranger",V S,NA,NA,Instantaneous,NA,NA,2,NA,Touch,Abjuration,NA,NA,NA,NA,SRD 5.0,NA,NA,NA,NA,NA,NA,NA,NA,NA,NA,NA,NA
https://roll20.net/compendium/dnd5e/Spells:Levitate#h-Levitate,Levitate,"One creature or object of your choice that you can see within range rises vertically, up to 20 feet, and remains suspended there for the Duration. The spell can levitate a target that weighs up to 500 pounds. An unwilling creature that succeeds on a Constitution saving throw is unaffected.The target can move only by pushing or pulling against a fixed object or surface within reach (such as a wall or a ceiling), which allows it to move as if it were climbing. You can change the target's altitude by up to 20 feet in either direction on Your Turn. If you are the target, you can move up or down as part of your move. Otherwise, you can use your action to move the target, which must remain within the spell's range.When the spell ends, the target floats gently to the ground if it is still aloft.",1 action,"Sorcerer,  Wizard",V S M,NA,NA,Up to 10 minutes,NA,NA,2,Either a small leather loop or a piece of golden wire bent into a cup shape with a long shank on one end,60 ft,Transmutation,NA,NA,NA,NA,SRD 5.0,NA,NA,Constitution,NA,Yes,NA,NA,NA,NA,NA,NA,NA
