https://roll20.net/compendium/dnd5e/Spells:Dispel%20Evil%20and%20Good#h-Dispel%20Evil%20and%20Good,Dispel Evil and Good,"Shimmering energy surrounds and protects you from fey, Undead, and creatures originating from Beyond the Material Plane. For the Duration, Celestials, Elementals, fey, Fiends, and Undead have disadvantage on Attack rolls against you. You can end the spell early by using either of the following Special functions.Break Enchantment: As your action, you touch a creature you can reach that is Charmed, Frightened, or possessed by a celestial, an elemental, a fey, a fiend, or an Undead. The creature you touch is no longer Charmed, Frightened, or possessed by such creatures.Dismissal: As your action, make a melee spell Attack against a celestial, an elemental, a fey, a fiend, or an Undead you can reach. On a hit, you attempt to drive the creature back to its home plane. The creature must succeed on a Charisma saving throw or be sent back to its home plane (if it isn't there already). If they aren't on their home plane, Undead are sent to the Shadowfell, and fey are sent to the Feywild.",1 action,"Cleric,  Paladin",V S M,NA,NA,Up to 1 minute,NA,NA,5,Holy Water or powdered silver and iron,Self,Abjuration,NA,NA,NA,NA,SRD 5.0,Melee,NA,NA,NA,Yes,NA,NA,NA,NA,NA,NA,NA
https://roll20.net/compendium/dnd5e/Spells:Dispel%20Magic#h-Dispel%20Magic,Dispel Magic,"Choose any creature, object, or magical effect within range. Any spell of 3rd level or lower on the target ends. For each spell of or higher on the target, make an ability check using your spellcasting ability. The DC equals 10 + the spell's level. On a successful check, the spell ends.At Higher Levels: When you cast this spell using a spell slot of 4th level or higher, you automatically end the effects of a spell on the target if the spell's level is equal to or less than the level of the spell slot you used.",1 action,"Bard,  Cleric,  Druid,  Paladin,  Sorcerer,  Warlock,  Wizard",V S,NA,NA,Instantaneous,NA,NA,3,NA,120 ft,Abjuration,NA,NA,NA,NA,SRD 5.0,NA,NA,NA,NA,NA,NA,NA,NA,NA,NA,NA,NA
https://roll20.net/compendium/dnd5e/Spells:Divination#h-Divination,Divination,"Your magic and an offering put you in contact with a god or a god's servants. You ask a single question concerning a specific goal, event, or activity to occur within 7 days. The DM offers a truthful reply. The reply might be a short phrase, a cryptic rhyme, or an omen.The spell doesn't take into account any possible circumstances that might change the outcome, such as the casting of additional Spells or the loss or gain of a companion.If you cast this spell two or more times before finishing your next Long Rest, there is a cumulative 25 percent chance for each casting after the first that you get a random reading. The DM makes this roll in secret.",1 action,Cleric,V S M,NA,NA,Instantaneous,NA,NA,4,"Incense and a sacrificial offering appropriate to your religion, together worth at least 25 gp, which the spell consumes",Self,Divination,NA,NA,NA,NA,SRD 5.0,NA,NA,NA,Yes,NA,NA,NA,NA,NA,NA,NA,NA
https://roll20.net/compendium/dnd5e/Spells:Divine%20Favor#h-Divine%20Favor,Divine Favor,"Your prayer empowers you with divine radiance. Until the spell ends, your weapon attacks deal and extra 1d4 radiant damage on a hit.",1 Bonus Action,Paladin,V S,NA,NA,Up to 1 minute,NA,NA,1,NA,Self,Evocation,NA,NA,NA,NA,SRD 5.0,NA,NA,NA,NA,Yes,NA,NA,NA,NA,NA,NA,NA
https://roll20.net/compendium/dnd5e/Spells:Divine%20Word#h-Divine%20Word,Divine Word,"You utter a divine word, imbued with the power that shaped the world at the dawn of Creation. Choose any number of creatures you can see within range. Each creature that can hear you must make a Charisma saving throw. On a failed save, a creature suffers an effect based on its current hit points.• 50 hit points or fewer - Deafened for 1 minute• 40 hit points or fewer - Deafened and Blinded for 10 minutes• 30 hit points or fewer - Blinded, Deafened, and Stunned for 1 hour• 20 hit points or fewer - killed instantlyRegardless of its current hit points, a celestial, an elemental, a fey, or a fiend that fails its save is forced back to its plane of origin (if it isn't there already) and can't return to your current plane for 24 hours by any means short of a wish spell.",1 Bonus Action,Cleric,V,NA,NA,Instantaneous,NA,NA,7,NA,30 ft,Evocation,NA,NA,NA,NA,SRD 5.0,NA,NA,Charisma,NA,NA,NA,NA,NA,NA,NA,NA,NA
https://roll20.net/compendium/dnd5e/Spells:Dominate%20Beast#h-Dominate%20Beast,Dominate Beast,"You attempt to beguile a beast that you can see within range. It must succeed on a Wisdom saving throw or be Charmed by you for the Duration. If you or creatures that are friendly to you are fighting it, it has advantage on the saving throw.While the beast is Charmed, you have a telepathic link with it as long as the two of you are on the same plane of existence. You can use this telepathic link to issue commands to the creature while you are conscious (no action required), which it does its best to obey. You can specify a simple and general course of action, such as Attack that creature, Run over there, or Fetch that object. If the creature completes the order and doesn't receive further direction from you, it defends and preserves itself to the best of its ability.You can use your action to take total and precise control of the target. Until the end of your next turn, the creature takes only the actions you choose, and doesn't do anything that you don't allow it to do. During this time, you can also cause the creature to use a reaction, but this requires you to use your own reaction as well.Each time the target takes damage, it makes a new Wisdom saving throw against the spell. If the saving throw succeeds, the spell ends.At Higher Levels: When you cast this spell with a 5th-level spell slot, the Duration is Concentration, up to 10 minutes. When you use a 6th-level spell slot, the Duration is Concentration, up to 1 hour. When you use a spell slot of 7th level or higher, the Duration is Concentration, up to 8 hours.",1 action,"Druid,  Sorcerer",V S,NA,NA,Up to 1 minute,NA,NA,4,NA,60 ft,Enchantment,NA,NA,NA,NA,SRD 5.0,NA,NA,Wisdom,NA,Yes,NA,NA,NA,NA,NA,NA,NA
https://roll20.net/compendium/dnd5e/Spells:Dominate%20Monster#h-Dominate%20Monster,Dominate Monster,"You attempt to beguile a creature that you can see within range. It must succeed on a Wisdom saving throw or be Charmed by you for the Duration. If you or creatures that are friendly to you are fighting it, it has advantage on the saving throw.While the creature is Charmed, you have a telepathic link with it as long as the two of you are on the same plane of existence. You can use this telepathic link to issue commands to the creature while you are conscious (no action required), which it does its best to obey. You can specify a simple and general course of action, such as Attack that creature, Run over there, or Fetch that object. If the creature completes the order and doesn't receive further direction from you, it defends and preserves itself to the best of its ability.You can use your action to take total and precise control of the target. Until the end of your next turn, the creature takes only the actions you choose, and doesn't do anything that you don't allow it to do. During this time, you can also cause the creature to use a reaction, but this requires you to use your own reaction as well.Each time the target takes damage, it makes a new Wisdom saving throw against the spell. If the saving throw succeeds, the spell ends.At Higher Levels: When you cast this spell with a 9th-level spell slot, the Duration is Concentration, up to 8 hours.",1 action,"Bard,  Sorcerer,  Warlock,  Wizard",V S,NA,NA,Up to 1 hour,NA,NA,8,NA,60 ft,Enchantment,NA,NA,NA,NA,SRD 5.0,NA,NA,Wisdom,NA,Yes,NA,NA,NA,NA,NA,NA,NA
https://roll20.net/compendium/dnd5e/Spells:Dominate%20Person#h-Dominate%20Person,Dominate Person,"You attempt to beguile a humanoid that you can see within range. It must succeed on a Wisdom saving throw or be Charmed by you for the Duration. If you or creatures that are friendly to you are fighting it, it has advantage on the saving throw.While the target is Charmed, you have a telepathic link with it as long as the two of you are on the same plane of existence. You can use this telepathic link to issue commands to the creature while you are conscious (no action required), which it does its best to obey. You can specify a simple and general course of action, such as Attack that creature, Run over there, or Fetch that object. If the creature completes the order and doesn't receive further direction from you, it defends and preserves itself to the best of its ability.You can use your action to take total and precise control of the target. Until the end of your next turn, the creature takes only the actions you choose, and doesn't do anything that you don't allow it to do. During this time you can also cause the creature to use a reaction, but this requires you to use your own reaction as well.Each time the target takes damage, it makes a new Wisdom saving throw against the spell. If the saving throw succeeds, the spell ends.At Higher Levels: When you cast this spell using a 6th-level spell slot, the Duration is Concentration, up to 10 minutes. When you use a 7th-level spell slot, the Duration is Concentration, up to 1 hour. When you use a spell slot of 8th level or higher, the Duration is Concentration, up to 8 hours.",1 action,"Bard,  Sorcerer,  Wizard",V S,NA,NA,Up to 1 minute,NA,NA,5,NA,60 ft,Enchantment,NA,NA,NA,NA,SRD 5.0,NA,NA,Wisdom,NA,Yes,NA,NA,NA,NA,NA,NA,NA
https://roll20.net/compendium/dnd5e/Spells:Dream#h-Dream,Dream,"This spell shapes a creature's dreams. Choose a creature known to you as the target of this spell. The target must be on the same plane of existence as you. Creatures that don't sleep, such as elves, can't be contacted by this spell. You, or a willing creature you touch, enters a trance state, acting as a messenger. While in the trance, the messenger is aware of his or her surroundings, but can't take actions or move.If the target is asleep, the messenger appears in the target's dreams and can converse with the target as long as it remains asleep, through the Duration of the spell. The messenger can also shape The Environment of the dream, creating landscapes, Objects, and other images. The messenger can emerge from the trance at any time, ending the effect of the spell early. The target recalls the dream perfectly upon waking. If the target is awake when you cast the spell, the messenger knows it, and can either end the trance (and the spell) or wait for the target to fall asleep, at which point the messenger appears in the target's dreams.You can make the messenger appear monstrous and terrifying to the target. If you do, the messenger can deliver a Message of no more than ten words and then the target must make a Wisdom saving throw. On a failed save, echoes of the phantasmal monstrosity spawn a Nightmare that lasts the Duration of the target's sleep and prevents the target from gaining any benefit from that rest. In addition, when the target wakes up, it takes 3d6 psychic damage.If you have a body part, lock of hair, clipping from a nail, or similar portion of the target's body, the target makes its saving throw with disadvantage.",1 minute,"Bard,  Warlock,  Wizard",V S M,NA,NA,8 hours,NA,NA,5,"A handful of sand, a dab of ink, and a writing quill plucked from a sleeping bird",Special,Illusion,NA,NA,NA,NA,SRD 5.0,NA,NA,NA,NA,NA,NA,NA,NA,NA,NA,NA,NA
https://roll20.net/compendium/dnd5e/Spells:Druidcraft#h-Druidcraft,Druidcraft,"Whispering to the spirits of nature, you create one of the following effects within range: You create a tiny, harmless sensory effect that predicts what the weather will be at your location for the next 24 hours. The effect might manifest as a golden orb for clear skies, a cloud for rain Falling snowflakes for snow, and so on. This effect persists for 1 round.
You instantly make a flower blossom, a seed pod open, or a leaf bud bloom.
You create an Instantaneous, harmless sensory effect, such as Falling leaves, a puff of wind, the sound of a small animal, or the faint odor of skunk. The effect must fit in a 5-foot cube.
You instantly light or snuff out a Candle, a torch, or a small campfire.
",1 action,NA,V S,NA,NA,Instantaneous,NA,NA,0,NA,30 ft,Transmutation,NA,NA,NA,NA,SRD 5.0,NA,NA,NA,NA,NA,NA,NA,NA,NA,NA,NA,NA
https://roll20.net/compendium/dnd5e/Spells:Earthquake#h-Earthquake,Earthquake,"You create a seismic disturbance at a point on the ground that you can see within range. For the Duration, an intense tremor rips through the ground in a 100-foot- radius circle centered on that point and shakes creatures and structures in contact with the ground in that area.The ground in the area becomes difficult terrain. Each creature on the ground that is concentrating must make a Constitution saving throw. On a failed save, the creature's Concentration is broken.When you cast this spell and at the end of each turn you spend concentrating on it, each creature on the ground in the area must make a Dexterity saving throw. On a failed save, the creature is knocked prone.This spell can have additional effects depending on the terrain in the area, as determined by the DM.Fissures. Fissures open throughout the spell's area at the start of your next turn after you cast the spell. A total of 1d6 such fissures open in locations chosen by the DM. Each is 1d10 x 10 feet deep, 10 feet wide, and extends from one edge of the spell's area to the opposite side. A creature standing on a spot where a fissure opens must succeed on a Dexterity saving throw or fall in. A creature that successfully saves moves with the fissure's edge as it opens. A fissure that opens beneath a structure causes it to automatically collapse (see below).Structures. The tremor deals 50 bludgeoning damage to any structure in contact with the ground in the area when you cast the spell and at the start of each of your turns until the spell ends. If a structure drops to 0 hit points, it collapses and potentially damages nearby creatures. A creature within half the distance of a structure's height must make a Dexterity saving throw. On a failed save, the creature takes 5d6 bludgeoning damage, is knocked prone, and is buried in the rubble, requiring a DC 20 Strength (Athletics) check as an action to escape. The DM can adjust the DC higher or lower, depending on the nature of the rubble. On a successful save, the creature takes half as much damage and doesn't fall prone or become buried.",1 action,"Cleric,  Druid,  Sorcerer",V S M,NA,NA,Up to 1 minute,NA,NA,8,"A pinch of dirt, a piece of rock, and a lump of clay",500 ft,Evocation,NA,NA,NA,NA,SRD 5.0,NA,NA,NA,NA,Yes,NA,NA,NA,NA,NA,NA,NA
https://roll20.net/compendium/dnd5e/Spells:Eldritch%20Blast#h-Eldritch%20Blast,Eldritch Blast,"A beam of crackling energy streaks toward a creature within range. Make a ranged spell Attack against the target. On a hit, the target takes 1d10 force damage.The spell creates more than one beam when you reach higher levels: two beams at 5th level, three beams at 11th level, and four beams at 17th level. You can direct the beams at the same target or at different ones. Make a separate Attack roll for each beam.",1 action,Warlock,V S,1d10,Force,Instantaneous,NA,NA,0,NA,120 ft,Evocation,NA,NA,NA,NA,SRD 5.0,Ranged,Cantrip Beams,NA,NA,NA,NA,NA,NA,NA,NA,NA,NA
https://roll20.net/compendium/dnd5e/Spells:Enhance%20Ability#h-Enhance%20Ability,Enhance Ability,"You touch a creature and bestow upon it a magical enhancement. Choose one of the following effects - the target gains the effect until the spell ends.Bear's Endurance: The target has advantage on Constitution Checks. It also gains 2d6 Temporary Hit Points, which are lost when the spell ends.Bull's Strength: The target has advantage on Strength Checks, and his or her carrying capacity doubles.Cat's Grace: The target has advantage on Dexterity Checks. It also doesn't take damage from Falling 20 feet or less if it isn't Incapacitated.Eagle's Splendor: The target has advantage on Charisma Checks.Fox's Cunning: The target has advantage on Intelligence Checks.Owl's Wisdom: The target has advantage on Wisdom Checks.At Higher Levels: When you cast this spell using a spell slot of 3rd level or higher, you can target one additional creature for each slot level above 2nd.",1 action,"Bard,  Cleric,  Druid,  Sorcerer",V S M,NA,NA,Up to 1 hour,NA,NA,2,Fur or a feather from a beast,Touch,Transmutation,NA,NA,NA,NA,SRD 5.0,NA,NA,NA,NA,Yes,NA,NA,NA,NA,NA,NA,NA
https://roll20.net/compendium/dnd5e/Spells:Enlarge%20Reduce#h-Enlarge%20Reduce,Enlarge Reduce,"You cause a creature or an object you can see within range to grow larger or smaller for the Duration. Choose either a creature or an object that is neither worn nor carried. If the target is unwilling, it can make a Constitution saving throw. On a success, the spell has no effect.If the target is a creature, everything it is wearing and carrying changes size with it. Any item dropped by an affected creature returns to normal size at once.Enlarge. The target's size doubles in all dimensions, and its weight is multiplied by eight. This growth increases its size by one category - from Medium to Large, for example. If there isn't enough room for the target to double its size, the creature or object attains the maximum possible size in the space available. Until the spell ends, the target also has advantage on Strength Checks and Strength saving throws. The target's Weapons also grow to match its new size. While these Weapons are enlarged, the target's Attack with them deal 1d4 extra damage.Reduce. The target's size is halved in all dimensions, and its weight is reduced to one-eighth of normal. This reduction decreases its size by one category - from Medium to Small, for example. Until the spell ends, the target also has disadvantage on Strength Checks and Strength saving throws. The target's Weapons also shrink to match its new size. While these Weapons are reduced, the target's attacks with them deal 1d4 less damage (this can't reduce the damage below 1).",1 action,"Sorcerer,  Wizard",V S M,NA,NA,Up to 1 minute,NA,NA,2,A pinch iron powder,30 ft,Transmutation,NA,NA,NA,NA,SRD 5.0,NA,NA,Constitution,NA,Yes,NA,The spell has no effect,NA,NA,NA,NA,NA
https://roll20.net/compendium/dnd5e/Spells:Entangle#h-Entangle,Entangle,"Grasping weeds and vines sprout from the ground in a 20-foot square starting from a point within range. For the Duration, these Plants turn the ground in the area into difficult terrain.A creature in the area when you cast the spell must succeed on a Strength saving throw or be Restrained by the entangling Plants until the spell ends. A creature Restrained by the Plants can use its action to make a Strength check against your spell save DC. On a success, it frees itself.When the spell ends, the conjured Plants wilt away.",1 action,Druid,V S,NA,NA,Up to 1 minute,NA,NA,1,NA,90 ft,Conjuration,NA,NA,NA,NA,SRD 5.0,NA,NA,Strength,NA,Yes,Any creature inside a 20-foot square from a point within range when the spell is cast,NA,NA,NA,NA,NA,NA
https://roll20.net/compendium/dnd5e/Spells:Enthrall#h-Enthrall,Enthrall,"You weave a distracting string of words, causing creatures of your choice that you can see within range and that can hear you to make a Wisdom saving throw. Any creature that can't be Charmed succeeds on this saving throw automatically, and if you or your companions are fighting a creature, it has advantage on the save. On a failed save, the target has disadvantage on Wisdom (Perception) checks made to perceive any creature other than you until the spell ends or until the target can no longer hear you. The spell ends if you are Incapacitated or can no longer speak.",1 action,"Bard,  Warlock",V S,NA,NA,1 minute,NA,NA,2,NA,60 ft,Enchantment,NA,NA,NA,NA,SRD 5.0,NA,NA,Wisdom,NA,NA,NA,NA,NA,NA,NA,NA,NA
https://roll20.net/compendium/dnd5e/Spells:Etherealness#h-Etherealness,Etherealness,"You step into the border regions of the Ethereal Plane, in the area where it overlaps with your current plane. You remain in the Border Ethereal for the Duration or until you use your action to dismiss the spell. During this time, you can move in any direction. If you move up or down, every foot of Movement costs an extra foot. You can see and hear the plan you originated from, but everything there looks gray, and you can't see anything more than 60 feet away.While on the Ethereal Plane, you can only affect and be affected by other creatures on that plane. Creatures that aren't on the Ethereal Plane can't perceive you and can't interact with you, unless a Special ability or magic has given them the ability to do so.You ignore all Objects and effects that aren't on the Ethereal Plane, allowing you to move through Objects you perceive on the plan you originated from.When the spell ends, you immediately return to the plane you originated from in the spot you currently occupy. If you occupy the same spot as a solid object or creature when this happens, you are immediately shunted to the nearest unoccupied space that you can occupy and take force damage equal to twice the number of feet you are moved.This spell has no effect if you cast it while you are on the Ethereal Plane or a plane that doesn't border it, such as one of the Outer Planes.At Higher Levels: When you cast this spell using a spell slot of 8th level or higher, you can target up to three willing creatures (including you) for each slot level above 7th. The creatures must be within 10 feet of you when you cast the spell.",1 action,"Bard,  Cleric,  Sorcerer,  Warlock,  Wizard",V S,NA,NA,8 hours,NA,NA,7,NA,Self,Transmutation,NA,NA,NA,NA,SRD 5.0,NA,NA,NA,NA,NA,NA,NA,NA,NA,NA,NA,NA
https://roll20.net/compendium/dnd5e/Spells:Expeditious%20Retreat#h-Expeditious%20Retreat,Expeditious Retreat,"This spell allows you to move at an incredible pace. When you cast this spell, and then as a Bonus Action on each of your turns until the spell ends, you can take the Dash action.",1 Bonus Action,"Sorcerer,  Warlock,  Wizard",V S,NA,NA,Up to 10 minutes,NA,NA,1,NA,Self,Transmutation,NA,NA,NA,NA,SRD 5.0,NA,NA,NA,NA,Yes,NA,NA,NA,NA,NA,NA,NA
https://roll20.net/compendium/dnd5e/Spells:Eyebite#h-Eyebite,Eyebite,"For the spell's Duration, your eyes become an inky void imbued with dread power. One creature of your choice within 60 feet of you that you can see must succeed on a Wisdom saving throw or be affected by one of the following effects of your choice for the Duration. On each of your turns until the spell ends, you can use your action to target another creature but can't target a creature again if it has succeeded on a saving throw against this casting of Eyebite.Asleep: The target falls Unconscious. It wakes up if it takes any damage or if another creature uses its action to shake the sleeper awake.Panicked: The target is Frightened of you. On each of its turns, the Frightened creature must take the Dash action and move away from you by the safest and shortest available route, unless there is nowhere to move. If the target moves to a place at least 60 feet away from you where it can no longer see you, this effect ends.Sickened: The target has disadvantage on Attack rolls and Ability Checks. At the end of each of its turns, it can make another Wisdom saving throw. If it succeeds, the effect ends.",1 action,"Bard,  Sorcerer,  Warlock,  Wizard",V S,NA,NA,Up to 1 minute,NA,NA,6,NA,Self,Necromancy,NA,NA,NA,NA,SRD 5.0,NA,NA,Wisdom,NA,Yes,NA,NA,NA,NA,NA,NA,NA
https://roll20.net/compendium/dnd5e/Spells:Fabricate#h-Fabricate,Fabricate,"You convert raw materials into products of the same material. For example, you can fabricate a wooden bridge from a clump of trees, a rope from a patch of hemp, and clothes from flax or wool.Choose raw materials that you can see within range. You can fabricate a Large or smaller object (contained within a 10-foot cube, or eight connected 5-foot cubes), given a sufficient quantity of raw material. If you are working with metal, stone, or another mineral substance, however, the fabricated object can be no larger than Medium (contained within a single 5-foot cube). The quality of Objects made by the spell is commensurate with the quality of the raw materials.Creatures or Magic Items can't be created or transmuted by this spell. You also can't use it to create items that ordinarily require a high degree of craftsmanship, such as jewelry, Weapons, glass, or armor, unless you have proficiency with the type of artisan's tools used to craft such Objects.",10 minutes,Wizard,V S,NA,NA,Instantaneous,NA,NA,4,NA,120 ft,Transmutation,NA,NA,NA,NA,SRD 5.0,NA,NA,NA,NA,NA,NA,NA,NA,NA,NA,NA,NA
https://roll20.net/compendium/dnd5e/Spells:Faerie%20Fire#h-Faerie%20Fire,Faerie Fire,"Each object in a 20-foot cube within range is outlined in blue, green, or violet light (your choice). Any creature in the area when the spell is cast is also outlined in light if it fails a Dexterity saving throw. For the Duration, Objects and affected creatures shed dim light in a 10-foot radius.Any Attack roll against an affected creature or object has advantage if the attacker can see it, and the affected creature or object can't benefit from being Invisible.",1 action,"Bard,  Druid",V,NA,NA,Up to 1 minute,NA,NA,1,NA,60 ft,Evocation,NA,NA,NA,NA,SRD 5.0,NA,NA,Dexterity,NA,Yes,Each object and creature in a 20-foot cube within range,NA,NA,NA,NA,NA,NA
